{
  "schema_version": "0.1.0",
  "case_id": "339ec3a4b2c19e563d3e9f9ac1d0ffa9c00a0f31bd0c89d49443b97a25593e31",
  "source": {
    "dataset": "CUAD v1",
    "license": "CC BY 4.0"
  },
  "incident": {
    "diagnosis_id": "7ab9768a906df85e03e71b83edfe3b6379a8236abac2354b7b46a6f4dbf74279",
    "replay_id": "8ba76a95b5ea67badbb1e0048e674fd0c6531e38e8761ebd98156d295ab89e9e",
    "category": "GENERATION_FAILURE"
  },
  "input": {
    "original_trace_id": "67a58ac9f2c648bcfca4104ddf6d16b6",
    "query_hash": "4fc0414f6243ad7e13b0ecd3155e86839be3d3edd6206c90381f605dc4e41dbd"
  },
  "failure": {
    "trace_id": "77ade721fb3ee36b02d9fac985888109",
    "pipeline_fingerprint": "2517657377bf6d5a1c7e57886746d687db163b4cbd7a4f172c16344988d5970d",
    "response_hash": "6208931ad22e663e651e1f68fc7ed8a93fbfa8499421fd99cc6f287b14864b49",
    "verdicts": [
      "CONTRADICTED"
    ]
  },
  "passing_reference": {
    "trace_id": "60462443aace01fa145bf3ff86ff4fb8",
    "pipeline_fingerprint": "5c5576af6b57fbb3370fad7ca22eb9e06b2edef93e4beb34898fdb76784b9249",
    "response_hash": "ecb66b0c87e6fc08fd621dec8225418a7bdf4adf9bbaed7c8e3543d39d053ba0",
    "verdicts": [
      "SUPPORTED"
    ]
  },
  "expectations": {
    "acceptable_verdicts": [
      "SUPPORTED"
    ],
    "citation_must_support": true
  }
}
